{
  "$schema": "https://json-schema.org/draft/2020-12/schema",
  "$id": "agent-workflow/schemas/artifact_registry_entry.schema.json",
  "title": "ArtifactRegistryEntry",
  "description": "Queryable current and versioned artifact/status record. Derived/query truth — not a replacement for event sourcing.",
  "type": "object",
  "required": [
    "schema_version",
    "artifact_id",
    "workflow_run_id",
    "work_item_id",
    "kind",
    "phase",
    "state",
    "path",
    "sha256",
    "produced_by_run_id",
    "source_event_id",
    "created_at"
  ],
  "properties": {
    "schema_version": {
      "type": "integer",
      "const": 1,
      "description": "Schema version for forward compatibility."
    },
    "artifact_id": {
      "type": "string",
      "pattern": "^[\\w-]+\\.[\\w-]+\\.[\\w-]+\\.v\\d+$",
      "description": "Structured artifact identifier: {workflow}.{work_item}.{kind}.{version}. Example: strategy_system_workflow_v1.step5.plan.v1"
    },
    "workflow_run_id": {
      "type": "string",
      "pattern": "^wfr_",
      "description": "Parent workflow run identifier."
    },
    "work_item_id": {
      "type": "string",
      "description": "Work item that produced this artifact."
    },
    "kind": {
      "type": "string",
      "description": "Pack-registered artifact type (e.g. plan, plan-review, review-adoption, plan-v2, execution-report, code-audit, final-audit, summary)."
    },
    "phase": {
      "type": "string",
      "description": "Pack-registered phase when this artifact was produced."
    },
    "phase_category": {
      "type": ["string", "null"],
      "description": "Optional common category for cross-pack queries."
    },
    "sub_phase": {
      "type": ["string", "null"],
      "description": "Optional pack-local detail."
    },
    "state": {
      "type": "string",
      "enum": [
        "PENDING",
        "RUNNING",
        "WAITING_APPROVAL",
        "FAILED",
        "COMPLETED",
        "CANCELLED"
      ],
      "description": "Core state when this artifact entry was created."
    },
    "path": {
      "type": "string",
      "description": "Absolute or repo-relative path to the artifact file."
    },
    "sha256": {
      "type": "string",
      "pattern": "^[a-f0-9]{64}$",
      "description": "SHA-256 hex digest of the artifact file content."
    },
    "produced_by_run_id": {
      "type": "string",
      "description": "Run identifier of the agent instance that produced this artifact."
    },
    "source_event_id": {
      "type": "string",
      "pattern": "^evt_",
      "description": "Event that triggered the creation of this artifact entry."
    },
    "created_at": {
      "type": "string",
      "format": "date-time",
      "pattern": "^\\d{4}-\\d{2}-\\d{2}T\\d{2}:\\d{2}:\\d{2}[+-]\\d{2}:\\d{2}$",
      "description": "ISO 8601 timestamp when this entry was created."
    }
  }
}
