{
  "schema_version": 1,
  "artifact_id": "strategy_system_workflow_v1.step2.plan-review.v1",
  "workflow_run_id": "wfr_test_001",
  "work_item_id": "step2",
  "kind": "plan-review",
  "phase": "REVIEW",
  "phase_category": "REVIEW",
  "sub_phase": null,
  "state": "COMPLETED",
  "path": "strategy/workflow/decisions/test_topic/260608-test-plan-review.md",
  "sha256": "a7ffc6f8bf1ed76651c14756a061d662f580ff4de43b49fa82d80a4b80f8434a",
  "produced_by_run_id": "run_test_002",
  "source_event_id": "evt_artifact_promoted_001",
  "created_at": "2026-06-08T12:05:00+08:00"
}
