{
  "schema_version": 1,
  "artifact_id": "strategy_system_workflow_v1.step1.plan.v1",
  "workflow_run_id": "wfr_test_001",
  "work_item_id": "step1",
  "kind": "plan",
  "phase": "PLAN",
  "phase_category": "PLAN",
  "sub_phase": null,
  "state": "COMPLETED",
  "path": "strategy/workflow/decisions/test_topic/260608-test-plan.md",
  "sha256": "e3b0c44298fc1c149afbf4c8996fb92427ae41e4649b934ca495991b7852b855",
  "produced_by_run_id": "run_test_001",
  "source_event_id": "evt_phase_completed_001",
  "created_at": "2026-06-08T12:00:00+08:00"
}
